{
  "title": "HQE Remediation Plan",
  "type": "object",
  "properties": {
    "title": {
      "type": "string"
    },
    "findings": {
      "type": "array",
      "items": {
        "type": "string"
      }
    },
    "phases": {
      "type": "array",
      "items": {
        "type": "object",
        "properties": {
          "phase": {
            "type": "string"
          },
          "objective": {
            "type": "string"
          },
          "actions": {
            "type": "array",
            "items": {
              "type": "string"
            }
          },
          "exit_criteria": {
            "type": "array",
            "items": {
              "type": "string"
            }
          }
        },
        "required": [
          "phase",
          "objective",
          "actions"
        ],
        "additionalProperties": false
      }
    },
    "patches": {
      "type": "array",
      "items": {
        "$ref": "patch-action.schema.json"
      }
    },
    "verification": {
      "type": "array",
      "items": {
        "type": "string"
      }
    }
  },
  "required": [
    "title",
    "findings",
    "phases"
  ],
  "additionalProperties": false,
  "$schema": "http://json-schema.org/draft-07/schema#"
}
